{
  "status": "PRECISA_DE_ESCLARECIMENTO",
  "derivavel": false,
  "justificativa_derivabilidade": "Apesar de a história conter regras de negócio muito claras para o backend e mapeamento de endpoints, ela omite o comportamento de fluxo da UI ao interagir com o diálogo de confirmação de cancelamento, o que impede a derivação precisa de casos de teste de interface (UI) sem a necessidade de assumir comportamentos.",
  "observacao_formato": "A história de usuário segue perfeitamente o formato padrão e identifica corretamente as telas e endpoints envolvidos.",
  "problemas": [
    {
      "criterio_id": "CA-05.1",
      "tipo": "omissao",
      "descricao": "O critério não especifica o comportamento esperado para as ações dentro do diálogo de confirmação (interação com os botões de confirmar e voltar).",
      "impacto_em_testes": "O analista de testes precisará deduzir se o clique em 'btn_confirm' fecha o modal e atualiza a listagem de solicitações para refletir o novo status, e se o clique em 'btn_back' apenas fecha o modal sem disparar a requisição.",
      "pergunta_para_o_product_owner": "Ao interagir com o 'request_cancel_dialog', o clique em confirmar ('btn_confirm') deve disparar o endpoint de cancelamento, fechar o dialog e atualizar o status na lista? O clique em voltar ('btn_back') deve apenas fechar o dialog sem alterar o estado da solicitação?"
    }
  ],
  "recomendacao": "Ajustar o critério CA-05.1 para detalhar o comportamento de sucesso e de desistência ao interagir com os botões do diálogo de confirmação na UI."
}
