{
  "status": "APROVADA",
  "derivavel": true,
  "justificativa_derivabilidade": "A história de usuário e seus critérios de aceitação são claros, específicos e alinhados com o contexto do sistema fornecido. Os critérios cobrem os fluxos positivo, negativo e de borda esperados para a criação de uma solicitação de serviço, incluindo validações de campos, atribuições automáticas do servidor e tratamento de autenticação. Todos os resultados esperados são observáveis e mensuráveis, permitindo a derivação direta de casos de teste funcionais sem a necessidade de inferir regras ou detalhes de comportamento.",
  "observacao_formato": "A história de usuário segue o formato esperado (persona, ação, benefício).",
  "problemas": [],
  "recomendacao": "Prosseguir para geração de casos de teste."
}
