{
  "status": "PRECISA_DE_ESCLARECIMENTO",
  "derivavel": false,
  "justificativa_derivabilidade": "Embora os caminhos felizes e o cenário de lista vazia estejam bem descritos, a ausência de definição sobre o comportamento do sistema para parâmetros de filtro inválidos e para requisições não autenticadas impede a derivação completa e segura dos casos de teste negativos e de borda sem que o analista precise assumir premissas não validadas.",
  "observacao_formato": "A história de usuário segue perfeitamente o padrão 'Como [persona], quero [ação], para [benefício]'.",
  "problemas": [
    {
      "criterio_id": "GERAL",
      "tipo": "omissao",
      "descricao": "Não há critério de aceitação que especifique o comportamento do endpoint 'GET /api/requests' quando a requisição não for autenticada (ausência de token ou token inválido).",
      "impacto_em_testes": "O analista de testes precisará assumir qual é o código de status HTTP retornado (ex: 401) e se há alguma mensagem de erro específica no corpo da resposta para o fluxo de não autenticado.",
      "pergunta_para_o_product_owner": "Qual deve ser o comportamento do endpoint e da UI quando um usuário não autenticado tentar acessar a listagem de solicitações? Deve retornar HTTP 401 com alguma mensagem específica?"
    },
    {
      "criterio_id": "CA-04.2",
      "tipo": "omissao",
      "descricao": "Não está especificado o comportamento do sistema quando valores inválidos ou não mapeados no enum de status ou prioridade são enviados como parâmetros de busca (ex: status=rascunho ou priority=urgente).",
      "impacto_em_testes": "Inviabiliza a criação de casos de teste de validação de parâmetros (negativos) com resultados esperados precisos (ex: se deve retornar HTTP 422 com o formato de erro do FastAPI/Pydantic).",
      "pergunta_para_o_product_owner": "Como o sistema deve se comportar ao receber valores inválidos nos filtros de status e prioridade na API? Deve retornar HTTP 422 Unprocessable Entity?"
    }
  ],
  "recomendacao": "Adicionar critérios de aceitação para cobrir o cenário de acesso não autenticado (retorno 401) e o envio de parâmetros de filtro inválidos (retorno 422), garantindo a cobertura de testes negativos."
}
