{
  "status": "PRECISA_DE_ESCLARECIMENTO",
  "derivavel": false,
  "justificativa_derivabilidade": "Não é possível derivar casos de teste funcionais completos para esta história de usuário sem inventar regras para cenários críticos. Faltam critérios de aceitação que especifiquem o comportamento do sistema para acesso não autenticado, para a validação de valores inválidos nos filtros de status e prioridade, e para a especificação de paginação na listagem, que é uma funcionalidade comum para listagens de dados.",
  "observacao_formato": "A história de usuário segue o formato 'persona: [papel], acao: [ação], beneficio: [benefício]', que é uma variação aceitável do formato padrão 'Como [papel], quero [ação], para [benefício]'.",
  "problemas": [
    {
      "criterio_id": "GERAL",
      "tipo": "omissao",
      "descricao": "A história e os critérios de aceitação não especificam o comportamento do sistema quando um usuário não autenticado tenta acessar a lista de solicitações. O contexto do sistema indica que `/api/requests/*` são endpoints protegidos, mas o comportamento exato para acesso não autorizado não está detalhado nos critérios.",
      "impacto_em_testes": "O Agente 1 não teria como saber o código de status HTTP esperado (e.g., 401 Unauthorized), a mensagem de erro ou o comportamento da UI (e.g., redirecionamento para login) para este cenário de segurança fundamental.",
      "pergunta_para_o_product_owner": "Qual é o comportamento esperado (código HTTP, mensagem, redirecionamento de UI) quando um usuário não autenticado tenta acessar a rota `/api/requests`?"
    },
    {
      "criterio_id": "GERAL",
      "tipo": "omissao",
      "descricao": "Os critérios não abordam o que acontece quando valores inválidos são fornecidos para os filtros `status` ou `priority` (e.g., valores que não pertencem aos enums definidos no glossário).",
      "impacto_em_testes": "O Agente 1 teria que inferir o código de status HTTP (e.g., 422 Unprocessable Entity, como indicado para falhas de validação Pydantic no contexto), a mensagem de erro e o impacto na UI ao tentar aplicar filtros com valores não permitidos.",
      "pergunta_para_o_product_owner": "Qual é o comportamento esperado (código HTTP, mensagem de erro) quando filtros de `status` ou `priority` recebem valores que não estão nos enums válidos?"
    },
    {
      "criterio_id": "GERAL",
      "tipo": "falta_de_dado",
      "descricao": "A história e os critérios não especificam se a listagem de solicitações deve implementar paginação (e.g., parâmetros `limit`, `offset` ou `page`). Sem essa especificação, a lista pode se tornar impraticável para um grande volume de dados e a funcionalidade de listagem estaria incompleta.",
      "impacto_em_testes": "O Agente 1 não pode gerar casos de teste para verificar o comportamento da paginação, como o número de itens por página, a navegação entre páginas, ou o comportamento quando não há mais páginas ou uma página inexistente é solicitada.",
      "pergunta_para_o_product_owner": "A listagem de solicitações deve implementar paginação? Se sim, quais são os parâmetros (e.g., `limit`, `offset`, `page`) e o comportamento esperado (e.g., tamanho padrão da página, resposta para página inexistente)?"
    }
  ],
  "recomendacao": "Solicitar esclarecimentos ao Product Owner sobre os pontos levantados nos problemas para garantir a cobertura completa dos requisitos e evitar ambiguidades na fase de testes."
}
