{
  "status": "APROVADA",
  "derivavel": true,
  "justificativa_derivabilidade": "A US-02 está bem escrita e permite derivar casos de teste funcionais sem que o analista precise inventar regras.",
  "observacao_formato": "O formato da história segue o padrão 'Como [papel], quero [ação], para [benefício]'.",
  "problemas": [],
  "recomendacao": "Prosseguir para geração de casos de teste."
}
