{
  "status": "PRECISA_DE_ESCLARECIMENTO",
  "derivavel": false,
  "justificativa_derivabilidade": "Não é possível derivar todos os casos de teste funcionais e de borda sem inventar regras, pois faltam critérios de aceitação para cenários importantes como validação de filtros, paginação e segurança (acesso não autenticado).",
  "observacao_formato": "A história de usuário segue um formato similar ao 'Como [papel], quero [ação], para [benefício]', com os campos 'persona', 'acao' e 'beneficio' claramente definidos. O conteúdo é claro e conciso.",
  "problemas": [
    {
      "criterio_id": "GERAL",
      "tipo": "omissao",
      "descricao": "Os critérios de aceitação não especificam o comportamento do sistema quando valores inválidos são fornecidos para os parâmetros de filtro `status` ou `priority`. Embora o contexto mencione validação para `RequestCreateIn`, não há clareza para query parameters de listagem.",
      "impacto_em_testes": "O Agente 1 teria que inferir o código de status HTTP (e.g., 422), a mensagem de erro esperada e o comportamento da UI ao tentar filtrar por valores que não pertencem às enumerações definidas.",
      "pergunta_para_o_product_owner": "Qual deve ser o comportamento do sistema (código HTTP, mensagem de erro, impacto na UI) ao receber valores inválidos para os filtros de `status` ou `priority` na requisição GET /api/requests?"
    },
    {
      "criterio_id": "GERAL",
      "tipo": "omissao",
      "descricao": "A história de usuário e os critérios de aceitação não abordam a paginação da lista de solicitações. Não há menção a parâmetros como `limit`, `offset`, `page` ou `per_page`, nem como o total de itens é gerenciado em listas paginadas. Embora CA-04.3 mencione `total=0` para lista vazia, não detalha o comportamento para listas com múltiplos itens.",
      "impacto_em_testes": "O Agente 1 não poderá gerar casos de teste para verificar a paginação, o número de itens por página, a navegação entre páginas, ou a consistência do `total` em listas paginadas, que são funcionalidades comuns para listagens.",
      "pergunta_para_o_product_owner": "A listagem de solicitações deve suportar paginação? Se sim, quais parâmetros de paginação devem ser suportados (`limit`/`offset` ou `page`/`per_page`), qual o tamanho padrão da página e como o total de itens deve ser retornado em listas paginadas?"
    },
    {
      "criterio_id": "GERAL",
      "tipo": "omissao",
      "descricao": "Os critérios de aceitação não incluem um cenário para acesso não autenticado ao endpoint de listagem de solicitações, apesar de o `system_context` indicar que `/api/requests/*` são endpoints protegidos.",
      "impacto_em_testes": "O Agente 1 não gerará um caso de teste fundamental de segurança para verificar que o acesso sem autenticação é rejeitado com o código de status e mensagem apropriados.",
      "pergunta_para_o_product_owner": "Deve ser adicionado um critério de aceitação para garantir que o endpoint `GET /api/requests` retorne 401 Unauthorized para usuários não autenticados, conforme especificado no `system_context`?"
    }
  ],
  "recomendacao": "Revisar a história de usuário e seus critérios de aceitação para incluir os cenários de validação de filtros, paginação e segurança (acesso não autenticado) antes de prosseguir para a geração de casos de teste."
}
