{
  "status": "APROVADA",
  "derivavel": true,
  "justificativa_derivabilidade": "A história de usuário e seus critérios de aceitação são claros, específicos e consistentes com o contexto do sistema fornecido. Todos os critérios são verificáveis e mensuráveis, cobrindo fluxos positivos, negativos e de borda de forma adequada. As regras de validação, códigos de resposta HTTP e mensagens de erro esperadas estão bem detalhados, permitindo a derivação direta de casos de teste funcionais sem a necessidade de inferir ou inventar regras de negócio ou comportamento do sistema.",
  "observacao_formato": "O formato da história de usuário está adequado, seguindo implicitamente o padrão 'Como [papel], quero [ação], para [benefício]'.",
  "problemas": [],
  "recomendacao": "Prosseguir para geração de casos de teste."
}
