{
  "status": "PRECISA_DE_ESCLARECIMENTO",
  "derivavel": false,
  "justificativa_derivabilidade": "A história possui critérios de aceitação bem estruturados, porém a falta de definição do texto exato da mensagem de sucesso e a omissão da regra de 'strip' para o campo de nome impedem a criação de casos de teste perfeitamente precisos sem que o analista precise assumir ou inventar comportamentos do sistema.",
  "observacao_formato": "A história de usuário não utiliza a sintaxe clássica 'Como [persona], quero [ação], para [benefício]', mas apresenta os campos equivalentes de forma estruturada (persona, acao, beneficio), o que é perfeitamente compreensível e não compromete o entendimento.",
  "problemas": [
    {
      "criterio_id": "CA-02.1",
      "tipo": "omissao",
      "descricao": "O critério indica que uma 'Mensagem de sucesso é exibida', mas não define o texto exato dessa mensagem.",
      "impacto_em_testes": "O gerador de testes precisará inventar o conteúdo textual esperado para validar o elemento 'register-success', o que pode gerar divergências com a implementação real do frontend.",
      "pergunta_para_o_product_owner": "Qual é o texto exato da mensagem de sucesso que deve ser exibida no toast de sucesso após o cadastro?"
    },
    {
      "criterio_id": "CA-02.3",
      "tipo": "omissao",
      "descricao": "O critério omite a regra de negócio descrita no contexto do sistema de que o campo 'name' não pode ser vazio após a remoção de espaços (strip).",
      "impacto_em_testes": "Não há garantia de que cenários de teste de borda enviando apenas espaços em branco (ex: '   ') serão mapeados para validar o retorno 422.",
      "pergunta_para_o_product_owner": "Podemos confirmar que nomes que fiquem vazios ou com menos de 3 caracteres após o 'strip' de espaços devem retornar 422, e adicionar essa especificação ao critério?"
    }
  ],
  "recomendacao": "Esclarecer o texto da mensagem de sucesso do cadastro e detalhar a regra de validação de espaços em branco (strip) para o campo de nome antes de prosseguir para a geração de casos de teste."
}
