{
  "status": "PRECISA_DE_ESCLARECIMENTO",
  "derivavel": false,
  "justificativa_derivabilidade": "Os critérios de aceitação, embora detalhados para o comportamento do backend, omitem informações cruciais sobre a experiência do usuário (UI) em cenários de erro e falha, o que impede a criação de casos de teste funcionais completos e verificáveis sem a necessidade de inferência ou invenção de regras por parte do analista de testes.",
  "observacao_formato": "A história de usuário segue o formato esperado 'Como [persona], quero [ação], para [benefício]'.",
  "problemas": [
    {
      "criterio_id": "CA-05.2",
      "tipo": "omissao",
      "descricao": "O critério especifica que tentar cancelar uma solicitação inexistente retorna 404, mas omite a mensagem de erro esperada no corpo da resposta. O contexto do sistema (`Semântica HTTP usada pela API`) especifica que o `detail` para 404 é `\"Solicitação não encontrada.\"`, mas o critério não o inclui explicitamente, ao contrário do que faz para o erro 403.",
      "impacto_em_testes": "O Agent 1 teria que inferir a mensagem de erro para o caso 404, o que pode levar a inconsistências se a implementação real não seguir a inferência. A ausência da mensagem na UI também não é especificada.",
      "pergunta_para_o_product_owner": "Para o caso de solicitação inexistente (404), a mensagem de erro `\"Solicitação não encontrada.\"` deve ser exibida na UI? O critério deve ser atualizado para incluir essa mensagem?"
    },
    {
      "criterio_id": "CA-05.2",
      "tipo": "omissao",
      "descricao": "Para os cenários negativos de tentar cancelar solicitação de outro usuário (403) ou inexistente (404), o critério descreve o comportamento do backend (status HTTP e ausência de alteração), mas não especifica o feedback esperado na interface do usuário (UI).",
      "impacto_em_testes": "Os casos de teste para esses cenários não poderiam verificar o comportamento da UI, como a exibição de uma mensagem de erro, o fechamento ou permanência do diálogo de confirmação, ou qualquer outra indicação visual para o usuário. O Agent 1 teria que inventar esses detalhes.",
      "pergunta_para_o_product_owner": "Qual deve ser o comportamento da UI ao tentar cancelar uma solicitação de outro usuário (403) ou uma solicitação inexistente (404)? Deve ser exibida uma mensagem de erro ao usuário? O diálogo de confirmação deve ser fechado ou permanecer aberto?"
    },
    {
      "criterio_id": "CA-05.3",
      "tipo": "omissao",
      "descricao": "Para o cenário de borda de tentar cancelar uma solicitação em status 'cancelada' ou 'finalizada' (409), o critério especifica o comportamento do backend (status HTTP, mensagem e ausência de alteração), mas não detalha o feedback esperado na interface do usuário (UI).",
      "impacto_em_testes": "Similar ao CA-05.2, os casos de teste não poderiam verificar o comportamento da UI, como a exibição da mensagem de erro `\"Somente solicitações 'aberta' ou 'em análise' podem ser canceladas.\"`, o fechamento ou permanência do diálogo de confirmação, ou qualquer outra indicação visual para o usuário. O Agent 1 teria que inventar esses detalhes.",
      "pergunta_para_o_product_owner": "Qual deve ser o comportamento da UI ao tentar cancelar uma solicitação que já está em status 'cancelada' ou 'finalizada' (409)? A mensagem de erro deve ser exibida ao usuário? O diálogo de confirmação deve ser fechado ou permanecer aberto?"
    }
  ],
  "recomendacao": "Revisar os critérios de aceitação CA-05.2 e CA-05.3 para incluir o feedback esperado na interface do usuário (UI) para os cenários de erro e borda, e para especificar a mensagem de erro completa para o status 404, conforme detalhado no contexto do sistema."
}
