{
  "status": "APROVADA",
  "derivavel": true,
  "justificativa_derivabilidade": "A US-05 é clara e bem estruturada, permitindo a derivação de casos de teste sem necessidade de inventar regras.",
  "observacao_formato": "O formato da história segue o padrão 'Como [papel], quero [ação], para [benefício]'",
  "problemas": [],
  "recomendacao": "Prosseguir para geração de casos de teste."
}
